text,misogynous
"gente che trascura le cose belle, che le hanno davanti, la fortuna la vedo a chi veramente non la merita.che trattano le donne, solo come oggetti.invece io, porca di quella troia bastarda e lurida non riesco a capire.",0
"mention1 mention2 ma che cazzo centra, cogliona esaurita?",1
mention1 mention2 mention3 ... ma porca puttana,0
mention1 ciao bellissima piacere massimo ???...ma sei veramente tu questa gran pompinara ?????,1
sta cosa del fisico madonna! ma seria?! ma porca puttana mo proprio scoppio amici17,0
riprendo questo tweet e mi chiedo questa partita del milan è difficilmente commentabile.                                               porca puttana maiala ladra.                       milansassuolo url,0
mention1 anyway non mi pare di aver mai fatto catfish con nessuno. avrei dovuto prendere una modella tettona argentina e avrei fatto follower a bizzeffe...invece sono ancora qui a dire le mie quattro cagate :) quasi in anonimato,1
"porca puttana,tom appena hai pianto tu sono scoppiata anch'io????? mi mancheranno tantissimo url",0
allargate i sedili: arriva la culona  lufthansa pronta a papparsi alitalia: depotenziato fiumicino url url,1
"rt mention1 vedi quella culona? sta leggendo fabio volo. io non scrivo per lei. avremo un pubblico ristretto, ma saremo riconoscibi""",1
mention1 bella bocca da pompinara ?????????,1
minchia cazzp vadfanxulo porca puttana,0
tua madre stronza troia zoccola di merda nel buco del culo di una scimmia ammaestrata balena di pinocchio cagna vaffanculoooooooooooooooooooooooooooooooooooooooooooooooooooooo,1
"mention1 lo so, è fantascienza!ma se l' europa di serie b"" si staccasse dall' euro,si aggregasse con moneta e regole comuni,sono convinto che nel giro di pochi anni la culona merkel ela grande germania, avrebbero le pezze al culo!a chi venderebb",1
"mention1 mention2 porca puttana, ma lhanno bombardata?",0
ma no loro mi urlano contro e mi fanno piangere dal nervoso quindi addio chimica. vaffanculo porca puttana,0
"mention1 mention2 mention3 mention4 io faccio fatica a vedere la differenza, dopo il nazareno. e a b non perdoneró mai due cose 1) di essersi dimesso di fronte alla culona che lo minacciava come un rammollito senza palle. 2) di essersi",1
mention1 se vieni a taranto ti sborro  da per tutto ti faccio sazziare di casso perché sei bellissima e bonazzaaaaaa baci baci dove vuoi tu,1
mention1 porca puttana giorgia ma che cazzo respiri che già ci sono io che lo sto facendo.,0
"mention1 ottimo, che pezzo di figa che sei. ti ha sfondato il culo, sei una gran gnocca da sbattere.",1
verò i tuoi drammi umani non giustificano il pensiero anche lontano di fare le corna a quel gran pezzo di figa della tua ragazza.sappilo gf15 veronica,1
"mention1 mention2 mention3 mention4 mention5 mention6 mention7 mention8 mention9 asia argento, una che avendo un cognome si agita e strepita per farsi un nome.",1
mention1 ti sfonderei il culetto aggiungimi troia,1
"mention1 mention2 mention3 mention4 mention5 mention6 mention7 mention8 mention9 asia argento, una che avendo un cognome si agita e strepita per farsi un nome.",1
basta vado a dormire sto 404 mi ha stressato mention1 chiattona schifosa domani quando mi alzo voglio vedere quel cazz di album siamo intesi url,1
che bella troia che sei url,1
"rt mention1 no fotoskiop...no figa di legno...ma patata originale made in italy..se ami il made in italy ritwitta, kiss url",1
"mention1 due giorni fa mi son dovuto sorbire le lagne di una tettona che aveva male allo sterno al punto da prendere antidolorifici; la mia ex tua omonima, quella a cui piaceva il vecchio porco"", parlava sempre di farsele ridurre. a parte a fare le s",1
"che poi cazzo scienze la studio porca merda e questa mi mette 4, ma ti inculo",1
mention1 mention2 tantissima fame di te!! pompinara.??????????,1
qualcuno porca troia mi spiega che cazzo è successo?,0
"mention1 quello che lo sconforto non dice soffoca qualsiasi placida empatia che comprensione non trova vanificato in solitaria vegenza"" url",0
mention1 mention2 mention3 mention4 mention5 mention6 mention7 mention8 mention11eu mention10 mention11 che bella figa ché ai mi piacerebbe leccare tutta amore mio ti scoperei,1
"mention1 è una figa di legno davide, mi disp ?",1
"wua e poi papa ha detto - puttanone ha fatto 51 aborti, tiene figa cosi grande, piazza garibaldi tiene in mezzo alle gambe, una che fa 51 aborti che cosa e????? si capisce che cosa e.!!!!!! ( wua che ridere)",1
ho ascoltato tutto il giorno calcutta e mi è piaciuto porca puttana,0
mention1 non cerco mica storie con impegno e non pensavo che tu fossi una figa di legnooo,1
mia mamma sta malissimo porca troia voglio morire,0
mention1 dio che troia che sei....mi fai sborrare tantissimo...,1
"comunque in tutto questo dramma non ci voleva molto a capire che benatia non intendesse stupro, principalmente dal contesto ma poi se non conoscete la lingua che cazzo traducete letteralmente cosa siete google traduttore",0
"mention1 ..non ho capito cosa hai scritto...ma confermo......melania è un bel gran puttanone.....e se fossi un capo di stato, chiederei a trump di farci un giro!!!!",1
tua madre stronza troia zoccola di merda nel buco del culo di una scimmia ammaestrata balena di pinocchio cagna vaffanculoooooooooooooooooooooooooooooooooooooooooooooooooooooo,1
e mentre ti tocchi te lo sbatto tutto in culo... url,1
mention1 porca puttana che figa che hai me la mangiarei a colazione pranzo spuntino e cena ogni giorno,1
porca puttana scionnnnnnnnnnn url,0
perche cazzo vi prendete i cani grossi se poi uscite tutta sera e li lasciate in casa da soli e piangono e abbaiano e la gente vuole dormire porca troia,0
ma porca troia mi calcoli che cazzo mention1 url,0
"mention1 io penso che ognuno di noi è libero di seguire chi gli pare, non credo serva il paladino della giustizia!!!!! torna tettona verbano!!!!!!",1
mention1 messa cosi con il mio cazzo ti sfonderei la figa e il culo.!! url,1
"piccinini che sfigato,il pistolero,il matador missile terra aria,figa ma come cazzo è messobarcellonaroma",0
"mention1 ahahahahahaha se ti dicono bella tettona mia"" concordo anche se mi imbarazza ma se ti dicono ""brutta tettona"" no""",0
"onestamente ma che cazzo è il traffico, guidate e basta, andate avanti, cosa vi frena, quella puttana della madonna non ho capito",0
mention1 hai un buco del culo e una figa da scopare,1
mention1 che cazzo te ridi? pari gianni morandi.,0
mention1 mention2 culona? ma stai scherzando vero ?,1
da domani faranno uscire i burn the stage ogni giovedì al posto che mercoledì.indovinate chi ha danza dalle 3:15 alle 4:30 il giovedì e arriva a casa alle 55:30?spoiler: io porca troia io. url,0
sei un gran pezzo di puttanone url,1
mention1 che cagna che sei anke io voglio fare pasqua cosi con te mmmmmm,1
"porca puttana che cazzo mette kalinic che non serve ad un emerito cazzo, quando entra sembra di fiocafe in 10 e quelle volte che fa qualcosa sbaglia pureeeee aaaaaaaaaaa",0
"mi è piaciuto un video di mention1 url cristina... porca puttana!"". christian de sica e massimo ghini - natale""",0
ma porca troia rino ti voglio bene vi volete levare dalle palle e far segnare il napoli o no? a che cazzo serve questo pareggio di merda dai mannaggia tutt cos mannaggia milannapoli,0
ma i carabinieri dove sono?? che cazzo fanno?? perché non vengono presi provvedimenti a seguito di così tante denunce?!? ma porca troia la legge la applichiamo o no?!? leiene,0
sono rientrata a casa da unora e avrò detto se la sarà sentitanon me la sento almeno una decina di volte questa è colpa di quella schifosa lurida,0
"mention1 mention2 mention3 a jonathan è scappata una offesa contro le donne, ha detto porca puttana...",0
"ho appena finito di vedere thesinner e porca puttana se merita quella serie! il vero peccato è che sia stata abbastanza snobbata.la biel poi vabbè, che ve lo dico affffá! ? consigliatissima! ? url",0
ma ammazzati troia,1
mention1 mention2 mention3 mention4 la nostra una società maschilista patriarcale non si può sentire....ma perché vedete donne che stanno ancora a casa a fare l'uncinetto e badare ai figli e basta? oppure non avete diritti come li hanno gli,1
mention1 li succhiava tutti la pompinara url,1
mention1 non ho mica detto che ti stupro,0
ora non so se restare a o tornare la mia tettona,1
"stasera le sto leggendo tutte.l'ultima:che ce ne facciamo della qualità artistica?""raga ma siete seri porca puttana???!ditemi di cosa vi fate perchè dev'essere davvero roba buona.""",0
mention1 ciao ramona bella tettona sei sempre sexi bellissima patatona bella bagnata uuummm,1
ci aggiornate porca puttana? mention1,0
"non riesco nemmeno a dormire, porca puttana",0
"non è possibile sta sfiga,altro autogol,porca puttana",0
mention1 pompinara di lusso,1
"selvaggilucarelli non sa recitare, non sa ballare, non sa presentare, diciamo che non sa fare nulla e l'unico motivo per cui si trova in tv è perchè è un puttanone che l'ha data a mezzo mondo...",1
porca puttana sono in treno dalle 8 e cè un tizio che non smette di parlare ma non sputi mai?,0
oggi mi sento un po' tettona,1
mention1 in realtà a lui piace (1) una tettona url,1
"ma porca puttana sempre tutto contro, sempre sempre e sempre",0
mention1 non nominare i serpenti porca puttana mi tocca controllare le coperte ora,0
"sul serio puttana ho completamente annientato il castello ti merta e ti è rimasto solo la follia  8 anni che ripete che è una artista, esatto opposto ti algoritmi, metoti, verificabolita... artista sul serio una skizo che protuce il bello commerciale. ora che cazzo vuoi",1
"passo sul 20. questi schifosi di premium non la trasmettono la roma"". cerco streaming. si bloccano. passo su telelombardia per 10 minuti, pubblicità. zapping canale 5. e porca puttana, la fanno qui!""",0
porca puttana..ha segnato ramsey..chi deve morire adesso?? arsenalcska,0
mention1 ma porca puttana anche tu,0
tra laltro continuo a guardargli le storie con laccount falso.raga.....la voce porca puttana. laccento.penso di morire. è stupenda. mi viene da piangere. aiuto.,0
mention1 mention2 non concordiamo affatto. è la figa di legno che piace alle donne.,1
mention1 fidati che la mamma puttana li avrebbe presi a schiaffi se avesse saputo come trattano i gatti,1
"porca puttana quanto fa freddo, e i termosifoni sono pure spenti, grazie al cazzo che sto male da dieci giorni",0
"salvini berlusconi humour bassa legaarrivati roma il console arrio silvio impartisce a matteo ben hur figlio adottivo i rudimenti politico sessuali mai dire culona""usa magari una parola latin-english url",0
mention1 ti sborro tutta anche le orecchie!!!,1
quando cazzo suona sta campanella porca puttana non ce la faccio più,0
mention1 lurida schifosa merda di cane,1
mention1 ammazza che bella tettona mmmmmm,1
scopata casalinga davanti alla tv con moglie italiana tettona url,1
pomeriggio5 barbara invidiosisdina che ci sia una naturale più tettona di lei,0
mention1 che bella figa ché ai mi piacerebbe leccare tutta amore mio ti scoperei tutta,1
mention1 e pensa che la mia migliore amica fa io so rispettarmi e poi il suo ragazzo le dice appena ti vedo ti stupro e lei ti amo tutta felice e sulle nuvole la mia faccia era basita,0
porca puttana quanto vorrei essere un romano allolimpico adessoromabarça,0
mention1 la merkel è una culona inchiavabile anche perché altrimenti si sarebbe chiavato pure lei,1
porca puttana che scazzo,0
ma se io fossi stata nei panni di gabriel chiusa dentro una stanza sola con negan porca puttana gli saltavo addosso e ciao proprio.. non sarei riuscita a trattenermi al fascino dello stronzo pezzo di merda thewalkingdead url,0
mention1 mention2 mention3 mention4 ma che cazzo dici??? allora se a uno non piace salvini significa che è comunista a prescindere! ????? dio perdonalo perché è idiota e non sa ciò che dice!!! dunque: io detesto salvini e non ho votato,0
mention1 mention2 mention3 mention4 mention5 mention6 mention7 mention8 grande follador! anche la tettona non è male....????????,1
"che poi che cazzo 5 argomenti in 40 minuti e chi cazzo sono oh,,, porca puttana quanto mi rode il culo ogni volta che facciamo un compito è così",0
che gran cazzoputtana evama che cazzo fateeeeeeeeeeeee juvenapoli,0
mention1 perché sei una cagna url,1
mention1 il crimibale sarko non ridecoiuccun la culona della ?,1
finalmente di nuovo con la mia polpettona culona coccodrillosa . url,1
"inter e niente parlo adesso che le romane sono sopra di noi e sono contente, a difrancesco che abbiamo il record di pali presi in tutta europa, a inzaghi che il gol di brozovic era buono oggi e quindi ultimamente la var ci ha tolto più punti che emozioni ultimamente.troie",0
"wua e papa a me ha detto- non hai vergogna, bevi sempre, e colpa dei genitori di tua madre, che educazione potevano darti, puttanone 51 aborti e marito alcolizzato, chi pigliava a quel cesso di tua babushka, solo un alcolizzato come quello la!!!!!!!! (wua che frase)",1
mention1 mention2 questa zoccola pompinara ha il culo rotto e la figa slabbrata dalla sua bocca esce sborra,1
"mi viene da piangere per il nervoso porca puttana eva, ma so che posso farcela",0
mention1 mention2 allora sei una tettona olly ??,1
rino io ti voglio bene te lo giuro ma porca puttana kalinic titolare nel derby noooooo ma cosa ti viene in mente,0
mention1 figlio di puttana ci sono le moviole. coglione guardale svegliati. che cazzo dj lavoro fai .il pippaiolo. sparisci merda,0
"nel frattempo sulla colombo ho clacsonato anch'io, altrimenti sembravo laziale.poco dopo una moto si è schiantata su una micra e un autobus ha tamponato una polo, credo che l'autista guardasse un puttanone sull'angolo accanto.diciamo che non ci si annoia guidando la sera.",1
fallo parlare un giornale ? deve dire cazzate ricordiamoci che la culona ci ha messo 6 mesi per fare il suo governo multicolore. url,1
mention1 che puttanone,1
mention1 anyway non mi pare di aver mai fatto catfish con nessuno. avrei dovuto prendere una modella tettona argentina e avrei fatto follower a bizzeffe...invece sono ancora qui a dire le mie quattro cagate :) quasi in anonimato,1
"mention1 non centra nulla con il gf ma trovo crudele aver trasmesso il video di isabella biagini ricoverata in un hospice per malati terminali, perché questo è lantea. dove ognuno di noi ha visto morire una persona cara. mia mamma . vergognat",0
mention1 mention2 mention1 povera puttana che sei,1
"mention1 guarda le mie replies e cringe-a con me. (quelle che bohoo la vecchia lara croft faceva schifo in quanto tettona, reboot movie lara è perfetta"" ma dove che non esiste neanche in canon che da giovane fosse piatta, lo hanno fatto solo per le",0
mention1 un puttanone appunto  ????,1
"mention1 no è solo che mi mette ansia quando cha il mestruo  porca troia, vedi te se mi devo trovare lesorcista che mi guarda con gli occhi rossi e  mi fa male la schiena ",1
mention1 ph porca puttana ma tutte sta settimana,0
"che dimostrate di non valere nulla come persone). pensate davvero di essere meglio di chi, di fronte ad uno stupro, dice beh aveva la gonna corta, se l'è cercata""? beh non lo siete :-)""",0
"mention1 si molto, legata, gancio nel culo, vibra nella figa, io che ti scopo in gola, e ti frusto quelle tettone, clito e grandi labbra... lo so sogno proibito... ma sognare non costa niente.",1
mention1 mention2 lei mention1 e' doppiamente una merda e pompinara avendo disonorato donne. lei e' una vergonga per il genere umano. arrampicatrice sociale de me cojoni. arrivista pompinara,1
mention1 mention2 mention3 mention4 mention5 mention6 mention7 mention8 mention9 mention10 mention11 ahahah porca puttana sembra che parli seriamente anche di questo argomento...la tua necessità di arrivare al,0
mention1 ti sborro in bocca,1
asia argento è una troia !! url,1
d a j e p o r c o  d i o!damato tua madre è una lurida puttana,1
alice figa di legno. lamafiauccidesolodestate,1
"è fallo, puttanone!",1
mention1 buona pasqua bella tettona!!! se vuoi farmi il regalo seguimi!!! ????,1
"tutte piatte, manco una tettona c'hanno messo gf15",1
"luca tommassini ma che cazzo ti dice il cervello, io sono indignata, ora esce sicuro zic, porca puttana amici17",0
linter ha perso contro il torino. mention1 mi ha sfottuto un sacco. io sono stato zitto e subito perché ha ragione lei. come sono maturo porca di quella troia dovevate solo fare gol merdaccia troia impestata figa il toro di mazzarri mazzarri merda ma che cazzo fate gol,0
mention1 mention2 il piu bel culo e la piu bella figa del web,1
porca puttana il lipsync di questa puntataaaaaaaaa url,0
mention1 porca puttana si scrive dylan!,0
mention1 ma porca puttana tutto oggi dovete fare madonna,0
mention1 mention2 mention3 mention4 buongiorno bella tettona,1
mention1 mention2 questa è la feccia che la culona ha importato,1
mention1 mention2 alessandra menzani è una giornalista che oggi a scritto cose mediocre su asia una donna che scrive cose mediocre sottomessa al potere maschilista forse per non perdere suo posto al giornale..,1
"eeeh i bei tempi andati di donna schiava, zitta e lava"", quelli sì che erano tempi! url",1
mention1 mention2 mention3 mention4 vorrei tanto che asia argento e laura boldrini incontrassero vis à vis questo propagandista. così potrebbero chiedergli dove vogiia andare a parare.,0
"mention1 mention2 non possiamo rendere una donna schiava del proprio corpo, vincolare il controllo che ha di se stessa ad una legge limitativa, rendere il suo uterobene demaniale"" ( metaforicamente parlando). certo, mi piacerebbe che nessuna",0
mention1 chi è sta bella figona tettona....,1
erdoan vuole bombardare la siria per liberarla. ora mi aspetto che si presenti con i capelli arancioni e un puttanone al fianco.mention1 erdoan erdogan siria,1
mention1 ti inculo col mio cazzo duro,1
mention1 mamma mia ti scoperei culo e figa come se non ci fosse un domani,1
"mi emoziono come una scema""...no tettona finta sei proprio scema isola""",1
"mention1 è quello che ti meriti, un porco che ti sbatte forte come una cagna in calore..che ti sfonda la figa a colpi di cappella e che ti riempie la figa di sborra calda ???",1
"mention1 mention2 non dica minchiate su! gli insulti no grazie, che siano i diti medi di asia argento o le sue frasi volgari e offensive.",0
porca puttana per colpa di quel giotto di merda sto cominciando adesso a fare i compiti per domani,0
ma quanti anni ancora dobbiamo pagare per quella maledetta coppa del 85 porco puttana che sfiga questa champions porca di quella puttana,0
porca puttana se gonalons a barcellona non faceva quella cazzata ora....  romabarcellona,0
mamma mia che bel culone. chissà se ha un profilo twitter. url,1
ogni volta che guardo lentrata del concerto mi metto a piangere e a ridere perché rivivo tutte le emozioni ma sento anche il porca puttana di alessia e quindi sfaso,0
ma porca puttana cosa cazzo sta combinando la lazio,0
"gf15 ma la smettete di dare del puttanone"" a qualunque donna non rientri nel vostro stereotipo della ragazza semblige, avete rotto il cazzo, ma chi ve se fila""",0
mention1 che schifosa puttanona,1
mention1 mention2 che bocce però...??,1
mention1 ma che cazzo ci commenti ancora? ma sta a casa porca puttana. ma basta. ma chi ti vuole. dateci longoni,0
voi ragazzi siete così complessati ma porca puttana andate tutti a fanculo,0
"qualsiasi cosa possa aver fatto o detto raoulbova, selvaggialucarelli mention1 si propone sempre per quello che è: una maleducata, villana, acida, pronta a attaccare tutto e tutti per fare show. mention2 da lei ricava solo una brutta pubblicità. peccato. url",1
"io non mi ti si piscio di striscio. io ti inculo capello liscio.  parma, italy url",1
mention1 figa di legno ahahahaha,1
mention1 sei una cagna in calore,1
"mention1 è una figa di legno davide, mi disp ?",1
"questa qui è solo una pompinara degli spagnoli,vergognati e comincia a tifare per valentino rossi  cal crutchlow è inglese però ? url",1
rimanere a tre dietro dopo quel primo tempo è una follia. una mattanza. eusè ma che cazzo hai fatto oggi porca troia.,0
mention1 porca puttana guardati un po url,0
porca puttana. incredibile. cristianoronaldo juvereal,0
mention1 mention2 bella figa da scopare,1
farà puttanone ma con la frangia stavo bene...io....?? url,0
mention1 mention2 pensaci mia bella tettona! ??,1
uno dei primi tempi più belli della stagione e siamo sotto porca di quella lurida troia ladra,0
"mention1 mention2 mention3 mention4 mention5 mi sembra azzardato misurare il consenso"" di asia argento con la cattiveria e l'odio che le riversano addosso gli adepti di salvini.""",0
ci provate proprio a farmi bestemmiare allora porca puttana,0
puttana merda non ci credo cosa ha preso sto fango di portiere fatti inculare frocio,0
"mention1 mention2 mention3 mention4 tutte balle...lasci stare salvini, pompinara.",1
mention1 splendida pompinara. sborrooooo,1
che sfiga ragazzi porca troia. la vittoria la meritavamo. realmadridjuve,0
io: dai forse non è vero che tutti mi odianotutti: no muori puttana,1
porco dio che cazzo di traversa madonna puttana,0
"il pulitzer a mention1 è la vittoria di tutte le donne vittime di violenza è il loro grido contro gli insulti, la verità contro ogni tentativo di bugia. è ogni donna che non ce l'ha fatta e che non se l'è cercata. è mention2 mention3 mention4 mention5",0
ma stiamo scherzando porca puttana url,0
mention1 mention2 lurida puttana! portali in spagna i tuoi schifosi clandestini!,1
ma che cazzo ??? url,0
brutta cagna che cazzo di sete hai???brava comunque così si fa!!!url,1
mention1 faccio prima a bruciarmi io porca puttana voglio nome e cognome di chi mi ha tirato il malocchio,0
mention1 mention2 mention3 salutami tanto quella culona deforme di marina che mi ha bloccato molto maleducatamente grazie vecchiazza,1
to be continued cosaaaa?!? cosa porca puttana,0
"si autodefinisce lapsicopatica e il problema è la figa altrui, tutto il regola cocca! url",0
mention1 che fantastica porca !! mi piacerebbe davvero innaffiartele a litri bollenti quelle tettone e poi giu tutto in gola,1
mention1 mention2 bel film! la migliore interpretazione di asia argento.gli hai dato un bel ruolo,0
mention1 mention2 daltronde la mention3 e asia argento sono impegnate su un palcoscenico più grande. che gliene fotte a loro?,0
"ma quanto vi credete simpatici quando fate battute del tipo donna schiava, torna in cucina""?""",0
mention1 caruso che cazzo dici. crozza si può permettere di offendere e benatia zitto? già gli diedero del marocchino di merda poi traducono con stupro una parola che nella.sua lingua ha altro significato. crozza fascia protetta invece fa quel che v,0
mention1 che tettona da sborrare sopra i capezzoli mmm,1
porca puttana io ho già i complessi sto mangiando un po' di riso e piselli dopo che non mangio da ieri mattina ma no devono continuare ad abbassarmi l'autostima,0
culona credo in te quindi ti prego non farmi passare per povero coglione che sta aspettando con tanta ansia della musica scadente ok,1
mention1 le professoresse mi chiamavano faccia dangelo ora capisco che magari a te si riferivano con faccia da troia ma stacci,1
mention1 mention3it mention3 mention3fr mention3de mention3es mention3uk mention3nl mention9 vorrei infilarci il cazzo dentro la tua bocca carnosa da pompinara bevila tutta la sborra calda che faccia da troia,1
mention1 mention2 beh se asia argento e una donna allora...,1
spacco qualcosa madonna troia bestia ladra inculata lurida maiala dio bastardo cane frocio,0
"mention1 ciao asia leggo su liberoquotidiano (on line) :asia argento, la lezione di isabella rossellini etc"". che ne pensi? cari saluti""",0
"mention1 mention2 hai rotto e continui a rompere il cazzo ma evidentemente inoltre sei anche masochista oltre che figa di legno, togliti dai coglioni!!!",1
"mention1 mention2 mention3 mention4 mention5 mention6 mention7 mention8 mention9 mention10 mention11 mention12 mention13 porca puttana!! smettila lucy!! ??non è mattina per il tuo culone, come ha",1
dite alla gran culona della merkel che anche le aziende tedesche sono inaffidabili.,1
io ho letto l'intervista in francese non ha mai detti stupro ha detto e stata un grossa inculata il giornalista italiano dovrebbe vergognarsi della traduzione url,0
mention1 bella culona. ..spettacolo ??????,1
sei una cagna con collare url,1
mention1 bella culona!?,1
che cazzo vi lamentate del fuorisalone che è una roba figa?,0
mention1 ti sborro nel culone mamma mia che bello???,1
"è dal 26 di dicembre che dovrei essere a dieta. porca puttana adesso è pasqua, domani pasquetta... insomma un casin pasqua pasquetta dieta",0
mention1 pure per me è na bocchinara non sai che stava a rai tre perche prima aveva preso a scappellare nella trasmissione invasioni barbariche marco patuano perché io avevo detto pompinara a mention2 infatti lui ad del milan le ha comprato b,1
mention1 lhipster sarà incazzato perché una tettona americana gli ha fermato il giro in centro a firenze,1
affidarsi solo ai gol di icardi comporta questo. servono due cazzo di attaccanti dai tempi di jovetic e ljajc. porca puttana!,0
mention1 godi allidea che tutti sapranno che sei una troia sfondata! vuoi che si sappia anche su altri siti puttana succhiacazzi?,1
questa culona meravigliosa si aggirava tra le scrivanie: e voi non vi sareste divertiti con lei? racconti erotici url,1
mention1 mention2 che puttana succhiacazzi!! e magari ingoia pure litri di sborra...,1
mention1 mention2 e a giugno torno a torino porca puttana ?,0
"reb fai conto che laltro giorno un vecchio si è avvicinato e ci ha provato con me, mi ha persino seguito e poi mi ha detto che...  ma questi son malati porca puttana url",0
oh borja puttana.....che sfiga gagliointercagliari,0
porca puttana mention1 realjuve finoallafine gitaamadrid,0
