text,misogynous
mention1 la prossima volta chiama me che oltre a riprenderti di da qualcosa di più duro da infilarti in quel gran pezzo di figa mmmmmmmm sei da infarto,1
porca puttana ma mia sorella ce la fa a mettersi i suoi vestiti e non i miei dio santo,0
mention1 mention2 mention3 confiscategli tutto. anche la moglie che si vergognava di essere italiana. ha fatto un grande affare .ed ora fatti un'altra risatina tu e la culona coi baffetti !,1
mention1 ma porca puttana è terribile! bastardi assassini.?????????,0
mention1 un puttanone appunto  ????,1
mention1 queste sono le tettone di mia mamma ...io le succhio ...????????????????????????????????????????????????????????????,1
mention1 mention2 ma vedi come se li gusta i due cazzi neri sta troia,1
mention1 culona!! gran bella culona!! ???ti adoriamo!!,1
mention1 ti sfonderei il culetto aggiungimi troia,1
mention1 ma che bel culone......,1
"oh, intanto dell'incontro tra la culona e macròn emerge l'esigenza di modificare i trattati ed introdurre un nuovo fondo europeo. tranquilli, il momento è tragico, ma nulla di serio.",1
rt mention1 mi chiamo paola e amo definirmi una milf tettona in cerca di cazzi......vuoi conoscermi gt;gt; url h,0
puttanona bella url,1
"mention1 è una pompinara! lha succhiato per mesi a vacchi, si è gonfiata bene anche le labbra per spompinare tutti gli autori del gf!",1
sono al cinema a guardare ragù player one e porca puttana quanto è bello.,0
"quelle puttane delle mie compagne tutto il tempo hanno preso per il culo un ragazzo di un'altra classe perché si é truccato e dicevano che faceva schifo e??????? cosa?????? ma siamo nel medioevo o cosa? oppure hanno detto é frocio ma non é gay"" che cazzo significa madonna mi""",0
"raga porca puttana sta canzone merita un casino guardate il video, comprate la canzone, ascoltatela su spotify. si impegna un casino lei, diamole ciò che merita 100grados url",0
mention1 mention2 quando salvini andrà in europa a mettere in riga la culona,1
fatti inculare e stai zitta troia che ti faccio uscire il sangue dal culo oggi url,1
mention1 tutto da cavalcare quel bel culone x ore e ore e ore,1
"mention1 guarda, non dirmelo che porca puttana che fastidio",0
"non sei una persona schifosa, ti prenderei a schiaffi ma sei una persona meravigliosa... lei è fortunata a poterti avere... url",0
mention1 a me ha dato fastidio leggere i 7 ma porca puttana aspettare un attimo non è cosa intelligente?,0
mention1 mention2 questo non vale manco la cravatta di galliani. ma porca puttana tutti noi i peggiori.,0
mention1 mention2 puttanona schifosa,1
minchia raga devo fare latino ma chi cha sbatta porca puttana maiala,0
mention1 sei una troia come angeliniciao zoccoletta!!! url,1
mention1 mention2 mention3 finalmente posso stappare assieme ad amici e parenti!!! finalmente è finita la tua dittatura e non dovremmo più sentire le tue assurdità da psicopatica!!! finalmente ti togli dalle palle... unico neo è che dovrebbe,1
mention1 che tettona?,1
"austin si avvicina,tutti pronti a tifare marquez e a sostenere quella pompinara di sua mamma.marquezuomodimerda",1
mention1 mention2 mention3 mention4 mention5 mention7eu mention7 mention8 mention9 mention10 mention11 mention12 che bella figa ché ai mi piacerebbe leccare tutta amore mio ti scoperei tutta,1
"wua e poi papa ha detto a mia madre- puttanone 51 aborti, deve stare al programma di record, gente rimane scioccata!!!!!! ( wua che frase)",1
mention1 ancora insulti contro aida: sei una cagna. zingara.ma i ragazzi pensano di avere ragione... gf15,1
mention1 vieni che ti sborro tutta,1
un porca puttana tra una role e unaltra ci sta,0
sono incazzata e mi sto riguardando le premiazioni. okay.1. mi sono rotta il cazzo dell'australia che cazzo ci fa all'eurovision2. san marino non smette mai di cagare il cazzo3. porca puttana(due anni),0
porca puttana ma vogliamo parlare di cleo toms che si sta facendo truccare da rihanna?ma a chi ha venduto lanima per avere tutte ste gioie?a chi?voglio il nome cazzo,0
mention1 bentornata su twitter tettona!!!,1
"mention1 che bel puttanone che sei, un troione mai visto",1
quanto cazzo posso godere quanto porca puttana troia posso godere,0
"so che abbiamo lo 0,01 di possibilità di passare, però voglio vedere una squadra che ci prova, voglio vederli lottare su ogni pallone, onorando davvero il nostro motto, fino alla fine porca puttana",0
"sto perdendo anni di vita, porca puttana  milaninter",0
"abbiamo già capito che entrerà la tettona, la terza dai. gf15",1
mention1 le professoresse mi chiamavano faccia dangelo ora capisco che magari a te si riferivano con faccia da troia ma stacci,1
"ma porca puttana, quello era rigorebarcaroma",0
ma porca puttana tutt ogg url,0
"mention1 perché sei una figa di legno, giusto?",1
"sono disperata per colpa dei 5sos, porca puttana",0
il segreto per posare il proprio culo sullautobus e non alzarsi per nessuna vecchietta o figa di legno: sedersi attaccati al finestrino e far sedere chiunque accanto a te. chiunque. sopravvivereadatacmerda,1
mention1 mention2 lurida puttana! portateli a barcellona i tuoi schifosi clandestini! vieni in italia e ti sparo in testa!,1
te lo lecco per ore lo assaporo tutto ci infilo pure la lingua siiii poi ti inculo prima dolcemente poi duro fino a riempirtelo tutto di sborra url,1
mention1 che bel culone mmmmmm,1
rt mention1 questi sono le persone perbene . mia mamma è morta e questi camorristi lo sanno. ascoltate revenge e andrea o come ti,0
mention1 mention2 quel nano brutto come la fame che rideva assieme alla culona,1
che cazzo mettete cmbyn che sto già piangendo porca troia gf15,0
mention1 mention2 mention3 quindi secondo voi servi il fatto che loro sono il primo partito come il partito della culona inchiavabile non conta nulla???????,1
"che inter schifosa...altro che championsleague, non la meritiamo proprio...",0
mention1 ti lecco tutta porcona messa così ti sborro sulle chiappe,1
ti sborro dentro culo mentre ti filmo url,1
"meglio perdere la qualificazione in cev come stasera ed evitarsi il viaggio in culo ai lupi che gara4, a mio avviso. però porca puttana manco un minimo di lotta, si faceva prima a firmare a tavolino sta partita. chiaro che manco alla squadra fa piacere perdere, però... clvolleym",0
ti sborro dentro culo mentre ti filmo url,1
"che troia, lurida puttanazitta, affoga e sborro dentro la tua baracosì almeno al tuo funerale di sicuro ti sentirai a casanon parlare brutta cagna che da oggi sono un cane anche ionon mi hai mai voluto dare il culo, adesso me lo prendo, porco do.",1
mention1 che gran donna e che gran bel culone ti inculerei volentieri per ore . e ti leccherei il buchino gia sporco di cacca mmmmm,1
mention1 mention2 madonna puttana cianone che cazzo di sfiga,0
cioè un mio amico di università è scomparso da ieri sera e non si riesce a trovare porca puttana ??,0
mention1 che bel culone!!!,1
mention1 la prossima volta chiama me che oltre a riprenderti di da qualcosa di più duro da infilarti in quel gran pezzo di figa mmmmmmmm sei da infarto,1
mention1 ci puoi giurare porca puttana,0
"dio, nella prossima vita, tettona e oca, grazie.",1
biondina tettona con belle coscione tutta da scopare url url,1
mention1 bel troione che sei!! ti sborrerei davanti a tuo marito quel povero cornuto,1
"però il mio capitano ha ragione che cazzo di fallo è urlaglielo ancora figlio di puttana"", urlalo""",0
facessero pace col cervello il pd ! ma a costoro del paese se ne fregano credono di giocare ad una partita  scacchi! la la  legge elettorale  schifosa l hanno fatta loro ed ora renzi fa i capricci  sarebbe da prendere a schiaffi . url,0
mention1 ma se sei aperta come una troia non credo che qulc'uno riesca a spaccarti ti sbattono come una vacca tesoro,1
mention1 perchè davanti ai furti ormai nessun tifoso della vecchia culona si vergogna,0
mention1 mention2 mention3 anche lei una culona inculabile semicit,1
mention1 lo vuoi un consiglio impiccati al cesso del pd di renzi bestia di una merdaccia ebrea schifosa,1
"mention1 mention2 mention3 mention4 mention5 mention6 mention7 mention8 mention9 asia argento, una che avendo un cognome si agita e strepita per farsi un nome.",1
mention1 anche io voglio essere la tua cagna pompinara....,1
"mention1 mention2 proprio lei, perchè non è il classico puttanone che ti fa solo sangue.",1
raga però porca puttana ora partono sfavoriti al derby...,0
"bitches in milaaaaan milan figa, si fatturaaaaaaaaaa url",0
mi dispiace un casino per buffon finire così porca puttana.rmjuve jvtblive finoallafine,0
mention1 faccia di cazzominchiafiglio di puttanamignottacagnacoglionesucchiacazziscemofessostupidoähhhh,0
porca puttana spero so riprenda subito cristo santo,0
mention1 di non essere tettona???,1
"dove porca puttana la trovo la voglia di alzarmi, farmi la doccia, andare a lezione, tornare, preparare una presentazione che non so come fare, lavorare e fare così in loop per tutta la settimana?",0
la gente non solo ti fa incazzarema poi ti lascia anche in visualizzato porca puttanamention1 sto per ammazzare bollettalo odio,0
mention1 mention2 oh!! ma sta a vedere che era un androide e non una donna comune!!mavaiacagaretuequellascrofaacida!,1
senti brendon urie la devi smettere non è possibile che ogni volta che esce una sua canzone sento il bisogno di cantare porca puttana url,0
mention1 porca puttana che figa che hai me la mangiarei a colazione pranzo spuntino e cena ogni giorno,1
oggi mi sento un po' tettona,1
jovanotti al 99 non farà il concerto stasera e che sfiga di merda porca troia.mai una gioia vai a giocare un po' più in là!,0
l'ex ministro mario landolfi prende a schiaffi l'inviato di giletti video url ok se ne sono andati a puttane tutti i vitalizzi!  ci sono azioni che possono essere soltanto a responsabiità personale,0
"mention1 si molto, legata, gancio nel culo, vibra nella figa, io che ti scopo in gola, e ti frusto quelle tettone, clito e grandi labbra... lo so sogno proibito... ma sognare non costa niente.",1
mention1 mention2 beh se asia argento e una donna allora...,1
mention1 mention2 buon pranzo a te meravigliosa tettona....,1
mention1 in realtà a lui piace (1) una tettona url,1
porca puttana troia harrystylesliveontourbologna url,0
jessica jones lavati ogni tanto porca puttana! isola,0
mention1 mention2 e quando la culona si leverà anche lei dalle palle!,1
"mention1 l'abito contiene a malapena le deliziose enormi naturali tettone puttanone e quei capezzoloni tutti da mordere, succhiare e bere senza sosta...e se dici basta ti prego"" non ti sento lt;3 lt;3 lt;3 lt;3 lt;3 lt;3 lt;3""",1
mention1 bella tettona mia ???????,1
ma perché la gente non si fa i cazzi suoi porca puttana,0
mention1 meglio un puttanone,1
mention1 ma porca puttana! adesso mi chiede ogni due secondi la licenza windows che non ho...,0
questa è roma questa è la roma questo è il popolo romano questa notte è leggendaria il calcio è meraviglioso daje romaaaaaaaaaaaaa porca puttana che orgasmo,0
mention1 perché sei una cagna url,1
"mention1 tu invece preferì s ci chi dà della culona ""alla a merkel oppure che fa slogan tipo viva putin in merito ad 1situazione internazionale molto pericolosa e delicata? mention2 nn è ancora pdc ed è opportuno  evitare dichiarazioni che nn gli",0
madonna vi unfollowo tutti porca puttana basta,0
mention1 filippinala parola culona (nina) flavioselfie infinitocappuccino un bonus con alain delon,1
"sto guardando i video del concerto e il mio oh porca puttana ora crepo"" prima che si esibisse con 'if i could fly' è pura poesia.""",0
mention1 mention2 mention3 mention4 mention5 mention6 mention7 mention8 mention9 cioè qua siamo di fronte a vette altissime di incoerenza. ..napoletano che tifa juve però prende in giro i piemontesi. ...cazzo ma porc,0
"mention1 ma vi siete chiesti perché la culona inchiavabile"" non ha preso posizione..? hanno quei famosi ""300mmm di ""ragioni""... per stare zitti..!!""",1
che cazzo di caldo porca troia...,0
mention1 porca puttana ma come è successo?,0
mention1 adesso fatte n'altra risata con la culona pezzo di merda,1
"che cazzo sono sti dolori di merda,per fortuna che ora si sono un po attenuati grazie al brufen ma,bho stavo morendo. e ci sono abituata ai dolori forti ma mai avuti così porca troia",0
mention1 eh .. dettagli .. rivoglio umbro porca puttana,0
var o no var! certo che no var non siamo mica la puttanona d'italia!? url,0
no ma io direi di giocare a fare la troia fino a che non ti apro davvero,1
un bel culo da sfondare? url  ?  ww videodi sesso it video incesto familiare italiano lei troia lui cornuto 3 scopate video private free xxx videoamatoriali carmella krossa giovane coppia amatorial,1
il giudice di porta e più figlio di troia dell'url dico.....che cazzo ci stai a fare....a pascolare le pecore?merda.,0
mention1 troietta ti inculerei e nel frattempo ti mungerei il cazzo e ti farei sborrare nelle mani poi aggiungerei la mia e ti farei ingoiare tutto troia,1
mention1 lo so. tu sei un bel puttanone madridista.,1
ma il puttanone di fianco a rush?,1
"mention1 ti sbatto in faccia le tettone, poi vedi come resti",0
"ma che cazzo alza la bandierina quel figlio di puttana se cè il var? tutto casuale... si. la colpa è del var, giusto?",0
"selvaggilucarelli non sa recitare, non sa ballare, non sa presentare, diciamo che non sa fare nulla e l'unico motivo per cui si trova in tv è perchè è un puttanone che l'ha data a mezzo mondo...",1
"ma non solo lui eh, anche sua sorella. e sono così stanca porca puttana, così stanca di essere così diversa. io sono sempre quella che viene derisa nelle cose, sempre. sempre messa al secondo posto, trattata male, battutone del cazzo dove solo loro ridono e hanno un idea di me ",0
"mention1 ma se stai li da massimo due settimane, manco hai giocato semifinali e finali ma che cazzo parli berreeee. vai ad accompagnare mention2 a puttane",0
porca puttana non ci posso nemmeno pensare che sta male,0
mention1 magari!!! ti scoperei e ti leccherei la figa tutta notte ??,1
azzeccasse un servizio porca puttana url,0
ho aspettato 80minuti i due gol del milan che avevo sentito in radio. nn so cosa cazzo avessi sentito ma porca puttana maiali quanto girano i coglioni,0
ma vogliamo parlare di quanto sia di cattivo gusto il contatore dei femminicidi al tg 2?il contatore? ma che cazzo è porca puttana,0
"mi spiace solo di non saper cantare. perché il mio sogno, ora, sarebbe fare il cantante melodico da balera romagnola. con una giacca di paillettes, il codone, ed una cantante tettona strizzata in un microabito che le evidenzia i rotoli, al mio fianco.dio, la bellezza.",1
mention1 ?????finoalconfineporca puttana,0
rt mention1 porca puttana stiles si deve connettere però,0
mention1 ti sposto le mutandine te lo metto nella figa e ti sborro nel culetto,1
mention1 aka mio compagno di classe che mi da della figa di legno solo per sentire l'urlo d'approvazione altrui. sei diventato più importante dimmi che non sai nemmeno qual'è la differenza tra 'a' senz'acca e 'ha' con l'acca,0
altre novità al salonedelmobile altre alla figa di legno?,1
mention1 ma che cazzo ce ne frega!!!!!! continuate a prendere per il culo figli di puttana!!!!!,0
"io, claudia e il mio amico alessandro: era iniziato tutto per caso... un giorno che claudia era un po' scollata, e alessandro senza peli sulla lingua mi disse scherzando: oh è proprio tettona claudia, non ci avevo mai fatto caso!"" lì per lì si concluse url",1
"piazzapulita ma sono da schiaffi, perdenti e renziani cagasotto, hanno fatto una legge elettorale schifosa, e ora fanno di tutto per ostacolare m5s, ma verranno ridicolizzati, non sanno cosa gli aspetta. tirapiedi di b. e di r.",0
mention1 a porca puttana troia.mi ero dimenticato della finale ?????,0
mention1 io non critico la henger... dico solo che è una figa di legno... ricordo ancora quando dovevano doppiarla nei film con rocco... roba da accaponare la pelle... bye,1
chi è questo puttanone? politically correct gf15,1
"stamattina mi sono svegliata ed il mio primo pensiero è stato porca puttana tra due settimane vedo harry""""",0
"al napoli mancherà la qualità della juve, mancheranno i cambi, mancherà anche qualche aiutino al momento giusto, ma porca puttana se ce l'ha un cuore!! e ora muti!!",0
"mention1 mention2 mention3 mention4 la gente normale non crede nulla, è un personaggio cinematografico e il cinema è arte, non ha colore politico, dovrebbe saperlo anche asia argento, che una volta era una artista e pur sapendo che fo",0
adesso come faccio?? porca puttana maiala,0
rt mention1 porca puttana ho appena evitato per un pelo una mia ex compagna di scuola e non oso immaginare che conversazione sareb,0
segnalatelo sto figlio di una lurida schifosa... url,0
oggi mi sento un po' tettona,1
"mention1 mia mamma si è permessa di usare la mia scatola super figa, a due piani, della stabilo",0
mention1 bella pompinara ??????,1
"se scrivi che weinstein o trump sono dei porci e dei maniaci tutti applaudono, ma se dici che selvaggia lucarelli è un puttanone sei sessista...",1
"mention1 l'arbitro ha avuto una personalità della madonna! questo quando ha visto il rigore ha pensato: ma porca puttana... come faccio a non fischiarlo anche se siamo al 93'? è troppo netto!"" e siccome ha personalità lo fischia... punto""",0
"mention1 mention2 mention3 perche credi che asia argento sia una fautrice rivoluzionaria delle donne? dopo 20 anni denuncia, ma per favore",1
"nte lascio più sto appiccicato alla tua tettona""cit mio fratellp""",1
mention1 ho voglia di riempirti quel bel culone ??,1
mention1 mention2 direi patrizia dalla descrizione (x descrizione intendo che dimostra 30 anni non per il puttanone),1
porca puttana se potessi farlo io a posto di tutte queste bimbette del cazzo. url,0
comunque chiara ferragni tettona sicuramente fra i regali più belli di questo 2018.,1
"ma che cazzo fate le dirette del concerto, porca troia godetevelo.",0
"mention1 ma che cazzo avete ancora da pubblicare pezzi di merda? ma vergognatevi invece di ringraziare che non meritate altro che uno stadio deserto! indegni figli di puttana. se volete scusarvi davvero, dimettetevi tutti dal primo all'ultimo che hanno ma",0
mention1 io se fossi tuo marito mi farei rizzare il mio di cazzo e mi farei segare con le tue mani ?che splendida troia che sei ??,1
"io alla mia coinqui con cui condivido la stanza voglio un sacco bene, però porca puttana non ce la fa a non far casino con la minima azioneboh ma ha qualcosa che non va o sono io super sensibile ai suoni???? cristooo url",0
mention1 si stava mandando video zozzi con una 18enne tettona magrissima,1
mention1 oltre che nn capire un cazzo 1 sei un camorrista zozzo 2 c hai la mamma puttana 3 la sorella bocchinara 4 va a morì ammazzato tu e tutta la tua lurida città 5 spero che il vesuvio te bruci vivo figlio della merda,1
bella quanto vuoi però se sei caga cazzi puoi startene nel tuo figa di legno,1
i miei genitori e mia sorella non capiscono mai un cazzo. io accetto volentieri laiuto di mia sorella ma come spiega lei quella merda è totalmente diverso dagli schemi della prof e in verifica io devo basarmi sulle parole scritte dalla prof porca puttana non è difficile,0
ma io non ce la faccio ma porca puttana ma perché a me cosa ho fatto di male vi prego denunciatelo voglio andare in inferno url,0
mention1 cazzo dovete vincere oggi cazzo altrimenti e' inutile settimana prossima forza inter da un napolista che cazzo ci vuole a fare un cazzo di gol porca puttana,0
"culona goldfinger  la germania naviga nelloro: ha le riserve piu grandi dopo gli usa, 3.374 tonnellate. e pensare che nel 1950 non cera un solo lingotto nei caveau della bundesbank  laccumulo e iniziato per contenere il url url",1
mention1 mention2 asia argento tutto il superfluo del pensiero,0
mention1 purtroppo lei non dice mai cose così così.... solo cattiverie da zitella acida,1
mention1 che bel culone .......,1
filippo porca puttana due ace proprio oggi no,0
mention1 mention2 mention3 la boldrini e asia argento! chissà in che lingua parleranno...esperanto forse,0
mention1 sì ma twitter ha messo apposta lo strumento dei thread porca puttana,0
mention1 siamo fottuti. non tanto per oggi ma per la prossima. porca puttana,0
mention1 chiamami porca puttana,0
"mention1 ma porca puttana, volevo guardarmi i playoff ora che sono senza esami e si rompe irving ma dai.",0
ma fate uno spareggio daniele vs sephora maria che cazzo ti fumi porca puttana amici17,0
"prendete esempio da benji e fede"" ai sonohra. is she even fucking real ma di  che cazzo parli madonna santa quanto ti asfalto porca troia se ti appendo e non sa manco usare l'italiano ma ti estingui url",0
porca puttana il video ci sta mettendo una vita per scaricarsi odio la mia wifi di merda,0
mention1 ???stupenda... anche la culona non sghizazza più... euromerde,1
"nemorai2 e allora porca puttana, legalizzatela !!!",0
rt mention1 mia khalifa - include la milf tettona juliana vega... con sborrata! url,1
"scuola elementare, bambino a mamma: stai zitta puttana, non me ne frega niente di quello che dici""mamma zitta.beati noi senza figli che non possiamo capire.""",1
mention1 lo so. tu sei un bel puttanone madridista.,1
"che faccia da cazzo. ma davvero ti piace questo? ma guarda che capelli di merda.eleonora ha proprio un problema con in capelli di edoardo ahahae comunque, carissima eleonora, quando sarai la sua ragazza ti sbatterò in faccia questa clip. ci siamo capite?skamitalia",0
"porca troia che cazzo di schifo il grande fratello, sarebbe da sospendere il programma, questo non è trash, è inciviltà allo stato puro, non è ignoranza che fa ridere. non se ne salva quasi nessuno, non ha nemmeno senso tenerli lì",0
mention1 fatti inculare troia url,1
che ansia quando devi organizzare cose (pasquetta) e ci sono maschi di mezzo che sì loro che importa decidiamo dieci minuti prima e poi partiamo no porca puttana io devo sapere devo organizzare,0
mention1 ma porca puttana ma riesci sempre a farmi ridere????,0
porca puttana troia questo non poteva tacere. stagione finita. url,0
eh avrò una mentalità antica ma io la penso così no chai na mentalità che porca puttana lo sterco di mucca te fa un baffo,0
mention1 certo che pure la figa di legno alla quale risponde eh....,1
classica pallavolista figa d'oro...,1
ma vaffanculo porca puttana giornata cominciata di merda a dir poco,0
ma a questa ballerina culona bravissima la cele non fa l'analisi del collo del piede?! amici amici17,1
"mention1 bella tettona! ci piacciono sempre, mica solo in notturna! molto sexy",1
mention1 ti sborro tra le dita,1
mention1 faccia da troia che ha la signora giulia url,1
porca puttana è davvero jolin tsai anche io voglio incontrare jolin tsai url,0
rt mention1 anna casalinga tettona blogneseanna gt;gt; url url,1
porca troia non sarebbe il massimo come persona ma che cazzo ho fatto di male per incontrare della gente del genere cristo di dio,0
io e la mia migliore amica ci completiamo. infatti lei è tettona.,1
mention1 che bella figa ché ai mi piacerebbe leccare tutta amore mio ti scoperei tutta,1
mention1 sei propio um puttanone mmm,1
aaaaahh che dolore adesso il nuovo format delle pagine shitposting italiane è un post tipo minchia frate laltro giorno ho scaricato nel cesso uno stronzo che porca puttana ti tiro un pugnoiiiisssssshh che dolore,0
mention1 mention2 mention3 mention4 la nostra una società maschilista patriarcale non si può sentire....ma perché vedete donne che stanno ancora a casa a fare l'uncinetto e badare ai figli e basta? oppure non avete diritti come li hanno gli,1
"mention1 per rispettare una certa progressione nell'insulto, nell'ordine ti direi: ateo, arricchito, culone e succhiacazzi lelegante",0
"mention1 ti sborro negli occhi"" cit. url",1
"-quindi, io dico, è giusto bei confronti di una donna tale gesto? chi siete voi per dare della puttana, troia, zoccola, pompinara, mangiacazzi e così via a una donna? mettiamola così, vostra madre per voi è una santa non lo metto in dubbio che siete i pri",0
mention1 tu invece verrai ricordata per la faccia da troia che hai,1
e mettetela sta cazzo di var in europa porca puttana. o non la mettono altrimenti barca e real non vincono  ? lanno scorso col psg in casa il barca è stato stra-aiutato dallarbitro. questa sera contro la roma pure uno schifo.,0
"benathia tocca la palla, svegliatevi tutti coglioni. prima di parlare almeno informatevi porca puttana. realjuventus",0
"mention1 quelle che sostiene indossando il velo? di femministe come lei non ne vogliamo, grazie. tantomeno chi si associa ad asia argento. si nasconda, il suo tempo è finito.",0
mention1 e se preferisci ti sborro in bocca o sulle tette,1
mention1 ma il termine tettona è un complimento supremo! url,1
avevo trovato un top carinissimo da piazza italia ma non mi sta perché sono tettona ??,0
mention1 tu  come  sempre  cara  merdel   fai  la  figa  rotta  con il  culo  degl  altri  stronza  psicopatica,1
martina se resti così a nanna te pensa a dormire che io ti inculo url,1
mention1 mention2 ma che puttana cve sei io ti faccio male che cazzo ucciditi,1
mention1 anche io voglio essere la tua cagna pompinara....,1
mention1 cazzo che gran pompinara..... gli piace proprio il cazzo....,1
"ma che poi perché noi donne dobbiamo soffrire ogni mese, chi l'ha deciso porca puttana.",0
apro il telefonotweet di halseyleggo europeurlo porca puttanasfondo il lettoapro la fotonon c'è l'italia,0
mention1 pure per me è na bocchinara non sai che stava a rai tre perche prima aveva preso a scappellare nella trasmissione invasioni barbariche marco patuano perché io avevo detto pompinara a mention2 infatti lui ad del milan le ha comprato b,1
"2 autogol e pique. porca puttana ladra, dio non può esistere, fanculo",0
pora nana vi son video metro rossetticertificati video con calzino ecc ecc ecc haha sei solo na pira troia da tastirmera.che infanga perche psicopatica,1
