text,misogynous
ma porca puttana juve juverm  juverealmadrid  finoallafine,0
paola sempre tettona non ci credo che stia lì di sua spontanea volontàper me l'hanno pagatagf15,1
mention1 mention2 asia argento quella che limonava il cane? com'è il suo pensiero verso la zoofilia?,1
mention1 sei tu...siete voi la fonte di repressione.....aveste fatto voi almeno un mezza cosa che hanno fatto i fascisti durante il ventennio....avete tolto il lavoro avete tolto i diritti ai lavoratori avete tolto la casa agli italiani.....dovete morire,1
zucca classico esempio di figlio di puttana partorito dal buco del culo di una lurida comunista qualsiasi.,1
voi del 2000 non capite che fortuna avrete a fare la maturità senza questa cazzo di terza prova che porca puttana fra simulazioni e tutto il resto mi sparo,0
mention1 taci puttana ladrones vergognati,1
mention1 ti sborro nel culetto,1
mention1 sei la tettona preferita,1
"rt mention1 ma porca troia ce la fate? che cazzo insultate federico quando ha risposto educatamente a quella ragazza, ma io davvero,",0
mention1 ti strappò le mutandine ti metto a 90 e ti inculo x bene ????,1
rt mention1 la tua schiava tettona mention2 guarda anche te mention3 url,1
"mention1 mention2 sotto quale lettera!c cene galanti, corna, corruttore, compravendita senatori?f fagiolini a 80 al kg?g gheddafi l'amico e poi inculato come si sa?l lodo mondadori?m mafioso, merkel l'inculabile culona?n la nipote di mubarak?p putin",1
porca puttana ci mancava solo la corrente che va via a porta garibaldi. questa giornata non finisce più,0
"mention1 mention2 e neanche qua hai la certezza, porca puttana",0
un messaggio alla lurida schifosa razza comunista di san giuliano milanese..verremo tutti a sputare sulle vostre tombe ....,0
in jam jam jun dice solamente baby play with me e say my name e porca puttana se mi fa sentire a disagio è fottutamente illegale solo per il modo in cui lo dice,0
mention1 ah sei interista porca puttana,0
mention1 mention2 ma che cazzo stai a dì?,0
ma porca puttana ma quale cazzo di lavoro ti da' la pensione dopo 10 anni ? ??? avete rotto il cazzo nonelarena,0
che sfiga ogni cazzo di volta cristosantonon è possibile porca troia perdere così realmadridjuve,0
"mention1 pero' io i berlusca me lo giocherei ancora ehhh .....ora che non c'e' piu' quel muso brutto di sarko e nemmeno l' abbronzato obama, oggi tra una merkel culona e un macron della sua stessa stazza ( fisica ) e' un pierrot  ci starebbe come il caci",1
raga porca puttana ci sto credendo fermatemi che mi faccio male cheplayoff,0
"wua mia madre diceva in russo nel muro alla signora vicina, devi morire grande puttanona, in russo pero che ridere.!!!!!!!",1
figa di legno,1
mention1 mmmmmmmmmmmmmm qnt ti scoperei ke belle tettone,1
vuoi sapere la mia. sei una cagna. senza a offesa ma abbai  bau url,1
roma romanaroma puttanai preti che girano sulla metropolitanaio ci vivrei in questa roma capocciacon in mano bastone e saccocciae faccio rime baciateun po' con l'accento romaneun po' che cazzo fatema ora vien la lirica,0
"che sfiga romagnoli , non ci voleva porca puttana...milansassuolo",0
"rihanna a milano a presentare fenty beauty e io poraccia a casa a pensare quanto bramo tutta la linea e rihanna, soprattutto rihanna!! sempre più figa!!!",0
rompicoglioni asfissiante su instagram: ce lho.rompicoglioni asfissiante su twitter: ce li ho.basta porca puttana lasciatemi vivere,0
"luigi: mia madre ha 47 anni vedessi che culo che cha, non come questa merda (alludendo ad aida)baye: sei una cagnadanilo: zingarapenso proprio che queste frasi si commentino da sole e penso anche che sia giusto farle girare senza tagli o censure. vergogna. gf15",0
"mention1 se vuoi vincere inizi con due punte, visto che lo scansuolo non schiera nemmeno babakar. di che cazzo hai paura ? devi vincere porca troia",0
"già sono incazzata di mio e ora ci si mette pure lui, che cazzo gli viene all'improvviso porca troia",0
mention1 ciao lucrezya buona sera e buona serata quanto 6 figa e sexy ti scoperei ?,1
ma porca puttana possibile che quando sto facendo qualcosa debba entrare il mondo in camera ma dai che nervi,0
"mention1 ciao caro, ti segnalo mention2 come singlesegni particolari: è tettona",1
"mention1 mention2 tu sei solo una lurida schifosa senza nessuna moralevoi celebrita' sapete solo vivere nelle vostre case lussuose lontani dai problemi dei poveritu sei una immorale schifosa, una donna bidonetorna nella tua fogna merda!",1
mention1 mention2 mai una donna mi ha fatto più schifo di asia argento. tutto quello che si ritrova è grazie al paparino. facile fare i comunisti con i soldi eh asia ? anoressica del cazzo,1
mention1 e porca puttana ti ho insegnato a tenere i pantaloni sempre alzati,0
puttana la miseria morali quanti schiaffi che ti darei. cafona inqualificabile. isola,1
"mention1 calmi un cazzo, puttana lurida.",0
"porca puttana per entrare e ripeto entrare in champions, non basta solo la scarsezza di una rosa tirata su da un ds incompetente, ma anche la iella. non oso immaginare quando torneremo a lottare per cose più serie...",0
"porca puttana quanto vorrei farmi jennifer lawrence.. dico, chi non vorrebbe!? url",1
"mention1 mention2 ma che cazzo stai dicendo neuroleso che io gli americani e i sionisti li odio , ma che sei un fascistone di merda ?",0
"mention1 datti una cazzo di regolata porca troia, ma che cazzo hai in testa, era necessario?",0
e se ho amici maschi sono troia e se non te la do sono figa di legno e ma vaffanculo,0
"si ma il cioccolato della kinder non è cioccolatono perché  è una droga porca puttana, è una cazzo di droga",0
mi ammazzo twitter porca puttana manco le censure ti meriti,0
perché considerare ala una poco di buono? perché non considerarla direttamente un puttanone? storiemaledette,1
"ma sono all'expo?! e la cipriani urla, urla, urla...cazzo urli?! non sei allo stadio, culona! non la reggo piú... si capiva?! ? isola",1
se solo penso che ieri la roma ha perso e oggi era la nostra grande occasione per andare al 3 posto e allontanarci dalla lazio..porca puttana ma perché dico io,0
mention1 mention2 buona sera amore mio ti inculo tutta,1
grande cavalcata di questa tettona!!!! url,1
mention1 mention2 prende il petto e poi l palla. e aggiungo un bel porca puttana,0
mention1 era quello che rideva assieme alla culona????...,1
mention1 apri che arrivo lo metto dentro e ti sborro,1
mention1 mention2 gita fuori porta con te subito fuori la porta di casa ti inchiappetto e ti trombo e ti sborro sulle tette,1
raga deve porca puttanase non si veste di verde lo picchiooo url,0
sto mese ho un mal di pancia assurdo che non sto in piedi porca puttana,0
mention1 la supplico in ginocchio di usarmi come una lurida cagna.,0
mention1 porca puttana che daga,0
"se scrivi che weinstein o trump sono dei porci e dei maniaci tutti applaudono, ma se dici che selvaggia lucarelli è un puttanone sei sessista...",1
"dannata puttana ti brucio, mention1 essi mio complice. url",1
"mention1 lo diceva già qualche anno fa anche la culona merkel che gli italiani sono tra i più ricchi d'europa e quindi dovrebbero estinguere il debito pubblico pagando qualche tassa in più. poi basta guardarsi intorno, vedo bmw mercedes e grandi s",1
mention1 - capelli - spirito guida - puttanone - cinema - boschetto,0
"ragazzi porca puttana sappiamo benissimo che viviamo in un paese di teste di cazzo razziste ma non potete fare ogni volta commenti del tipo se fosse stato un immigrato"" quando viene uccisa una donna dio cane è stata uccisa una donna pensate a lei""",0
ma che cazzo stai dicendo url,0
"se trump vs con un puttanone è immorale, se killary  ride isteriamente ( gallina quale è ) all omicidio gheddaffi è tutto ok. lo schifo non ha limite",1
"alla radio danno la passion di gigi dagostino, bellissima e tamarra come la ricordavi, e ti rendi conto che sono passati 19 anni e porca puttana ma quanti anni ho?!? sabato",0
classica pallavolista figa d'oro...,1
"ancora espressioni dei  nuovi stili di vita"" tanto decantati dalla baldracca, grassa e schifosa comunista, che una volta stava alla ""camera""! url",1
un'ex studentessa della mia scuola ha tentato il suicidio buttandosi dal sesto piano e adesso è in coma porca puttana non ci posso credere,0
non fatemi piangere porca puttana? url,0
"però la foto con la maglia dei rolling stones no eh, non lo accetto. quella è la maglia del tramonto sul danubio porca puttana",0
mention1 ora tocca alla culona..facciamo saltare l' e vedi che lacrimoni gli facciamo scendere...,1
"mention1 valery ti prego anche io voglio leccarti la figa e scoparti,come posso incontrarti,ti prego mi fai arrapare della madonna.????????",1
"icardi è felice di non andare al mondiale. può tifare contro l'argentina, se ne va in vacanza e si scopa quella scrofa tettona...chiamalo  fesso",1
mention1 puttana che cazzo vuoi,1
"mention1 mention2 mention3 mention4 mention5 mention6 mention7 nel caso specifico, in relazione alla rivelazione di asia argento sulle molestie subite, é stato impossibile non notare la differenza (in peggio) tra la rea",0
"mention1 mention2 si , cisi mi sego e ti sborro slla foto",1
mention1 siamo in due ivan porca puttana,0
marcelo altro simulare del cazzo porca puttana,0
che cazzo ga ma tu stai scherznado porca troia ti ammazzo ma oh ma ti sembra il caso così dal nilla vaffanculo url,0
la figa che dice che abbiamo scopato che cazzo vuole da me???,1
"mention1 mention2 mention3 mention4 oh pirla e quindi? quelli che hanno fatto il servizio sulla vostra curva, rappresentano tutta la nazione? che cazzo di ragionamenti fate porca troia!",0
mention1 mention2 ho la sensazione che le dichiarazioni di allegri siano prese per il culo!!spero che abbia qualche buon asso nella manica! la partita di ieri è stata un affronto a tutti i tifosi juventini. ma che cazzo allegri! porca troia,0
"mention1 aah la preferisci acqua e sapone. io la preferisco più puttanone da combattimento, tipo così url",1
"sto visionando dei cv, ma porca puttana questi fanciulli sono nati tutti negli anni 90.",0
"perchè è un po' come me. tutte quelle volte in cui è stato preso a schiaffi in faccia dalla vita, tutte quelle cose schifose che scrivono su di lui, le legge. e fanno male. io non voglio che stia male. gli auguro tutta la felicità di questo mondo, gli auguro momenti felici",0
e la baldracca che non sa più da che parte girarsi se la tengono i morti di figa che lhanno assecondata. ve la meritate.,1
mention1 apparato riproduttore oppure la tettona placche,1
che cazzo centra kalinic con diabatè?! siete ossessionati porca troia.,0
rt mention1 porca puttana url,0
mention1 mention2 che gran troia....che tette....ti inculo tutta mary.....mmmm,1
le frasi che dico più spesso sono o porca puttana o che deficiente boh ok,0
mention1 lo so. tu sei un bel puttanone madridista.,1
"mention1 come ho già dett,o se si da del puttaniere, porco maniaco a weinstein tutte le donne applaudono (comprese quelle che lo hanno opportunisticamente sfruttato). se invece si da del puttanone a selvaggialucarelli che voelva fare sesso con siffred",1
bellissima culona url,1
rt mention1 tra la genovese e la napoletana chi è la più puttana?chi sarà la più troia tra la tettona campana antonietta e la ge,1
mention1 pompinara di lusso,1
mention1 mention2 lei mention1 e' doppiamente una merda e pompinara avendo disonorato donne. lei e' una vergonga per il genere umano. arrampicatrice sociale de me cojoni. arrivista pompinara,1
"mention1 da morire...wow...sarei capace di farmelo succhiare mentre fai pipì e dopo te lo infilerei a gambe aperte,nella tua figa ancora bagnata",1
mention1 sei una cagna,1
"mention1 salvo poi mandare la culona a mosca, aummaumm, per farsi dare da putin commesse multimiliardarie e metterlo in quel posto ai fratelli della ue (tra i quali noi)",1
"mention1 mention2 un rigore inesistente? ma porca puttana io me incavolo perché gli ha dato una ginocchiata sotto l' ascella è evidente, da dietro e se non lo faceva quello segnava mesa che non l' hanno capito.....e comunque ripeto io me incaz",0
"mention1 quindi tutti scandalizzati per il meme e soprattutto per il commento a corredo...cosa mi dite del cartone animato south park? vengono derisi anche li' i ciccioni... ad esempio, nel film di south park, c'e' la canzone la mamma di kyle e' u",1
mention1 mention2 ma porca puttana porca.,0
mayerlin la gocha solo gente seria culona bella url,1
"all'intervallo parlando con sta mia amica faccio ''x ha un bel culo'' a voce abbastanza alta, mi giro e mica ce l'ho dietro figa",0
mention1 che gran donna e che gran bel culone ti inculerei volentieri per ore . e ti leccherei il buchino gia sporco di cacca mmmmm,1
ma porca puttana.buffon sei il numero 1. sempre. juvereal,0
classica pallavolista figa d'oro...,1
"tranquilla figa di legno, ti accetto proprio per quello che sei.",1
mention1 wow che bel culo wow ass boob bellissima figa,1
ma che cazzo di problemi avete porca puttana?! come fate ad eliminarmi una meraviglia come sephora e a tenere una come valentina che se sa ballare bene la macarena è già tanto amici17,0
mention1 ma taci puttana.. stanno tornando a verona finitela,1
"xche brutti ci si nasce....pero...porca puttana che occhi???  scandolara ripa d'oglio, italy url",0
porca puttana ho perso dieci anni di vita,0
mention1 mention2 arriverà il giorno che anche la culona smetterà di ridere,1
"madonna quel sorriso, ma io mi sento male porca puttana url",0
mention1 mention2 porca puttana mi sembri una di quelli che alle medie mi tiravano le pizzette quando mi vedevano mangiare qualcosa solo per il gusto di vedermi piangere,0
"mention1 mention2 mention3 perche credi che asia argento sia una fautrice rivoluzionaria delle donne? dopo 20 anni denuncia, ma per favore",1
raga porca puttana come avete fatto a fare delle foto così belle mado le mie fanno cagare,0
mention1 mention2 praticamente asia argento che lavora da anni ha svoltato con la politica,0
rt mention1 ma l'attrice natalie wood era considerata una figa di legno?,1
"storiemaledetteun gran puttanone sta ala, diciamocelo....",1
"mention1 trattasi di una lurida supremazia maschile. il sesso ha tante sfaccettature, seppur senza amore non fa male a nessuno.  lo stupro invece è un indelebile tatuaggio dell anima che la persona si porterà addosso a vita!",0
ti scopo questa lurida fica puttana e poi ti sborro in bocca url,1
? sonoungrandissimoporco2: tutto in golatroia! url,1
"mention1 grazie mille, sei un tesoro, ma non mi starebbero  in foto non sembra ma sono una culona :)",1
"porca puttana avrei dormito altre 70 ore ma no, sono in piedi perchè alle 4 entro al lavoro e per quellora devo aver fatto 7mila cose",0
che cazzo significa i placebo in italia ma porca troia chi cazzo gliel'ha proposta la data a tarantoa taranto cazzo son tipo più di 850 km da casa mia piangooo,0
"mention1 un vomito più che rigurgito, questo comunista assieme alla culona in6 anni è riuscito a quintuplicare il numero di poveri in italia",1
mia mamma: al grande fratello cè una ti somiglia troppo nei modi di fare vado a vedere il personaggio è una demente figa di legno e che sta sul cazzo a tutti. ok grazie mi fa piacere questo accostamento mamma,1
rt mention1 cioè la gente in metro con i giubbotti colmar della neve ma porca puttana ma state male? 45 gradi. io mi sono aperto i,0
schifo scienze di merda mi fai schifo. evviva l'irrazionalismo porca puttana fra poco sputa dal culo tutta sta merda di scuola. fanculo cazzo,0
"mia ma che cazzo rt, porca troia url",0
ma abbiamo i mezzi perché nn vengono usati porca puttana ??????? ladri di m................???????????????,0
il vitino da vespa mal si intona al culone da balena cit la sezione aurea estate bellezza,1
sono uscita con dei miei amici simpaticissimi e carinissimi ma poi si fanno certe uscite (anche le ragazze) del tipo ma quella si veste troppo da troia!! si é fatta mezza torino!! e io ci rimango male perché cazzo mi sembrate pure decenti e poi dite ste stronzate,0
"mention1, elimina dalla faccia della terra tutte le persone che pensano che la donna sia solo: donna schiava zitta e lava.",0
porca puttana troia se non lo ha fatto per me! url,0
mention1 fantastica tettona....,1
"mention1 porca puttana non se ne esce più da sto pantano, ho come un senso di rassegnazione.",0
mention1 eh...la prima è gia finita porca puttana!?,0
"mention1 federico hai una faccia da ti stupro la famiglia""""",0
mention1 aceco letto puttanona ..???,1
mention1 mention2 così tettona che in ogni foto le tette sono diverse ???,1
"ho grandissimo rispetto x gli anziani. ma porca puttana non avete niente da fare tutto il giorno, perché alle 8.15 sei già li in posta ?? cazzo perché che io ho i secondi contati?!? ma un minimo di pietà! url",0
tesoro mio. porca puttana jauregui non dire ste cose che mi emoziono. url,0
mention1 ciao moglie tettona vogliamo essere amici? io il tuo infedele amico.,1
"omnibusla7 dite al francese che trump lo sta mettendo in culo al suo micron, alla culona  e a quel coglione di junker, grande alcolizzato",1
"siete dei falsi, che cazzo di nervoso. url",0
"data la scarsità di argomenti di polemiche, tirerei fuori qualcosa del passato: se elena ha deciso di vivere a troia con paride perché cazzo devi chiamare gli amici tuoi e andare a scassare la minchia agamennone di merda oh mettiti il cuore in pace",0
mention1 mention2 mention3 fammi capire... asia argento scrive salvinimmerda e salvini risponde dicendo ... personcina per bene!? .... mi potresti spiegare secondo te chi insulta chi?! ???,0
"mention1 parlo di quelle vecchie! credo sia proprio la tettona, se mi dici il nome me la ricordo! (forse)",1
mention1 porca di quella lurida puttana della madonna di merda,0
mention1 ma porca puttana maledetta,0
mention1 mention2 e il puttanone finto stalinista che centra?,0
amica tettona! url,1
non ce tempo pi le puttane false. che cazzo e chistu minchiata?!,1
mention1 mention2 scusami ma....che sfiga!,0
ma porca troia ho scoperto che mia mamma ha fatto le foto al libricino in cui sono scritte tutte le password etc ma i cazzi tuoi no,0
"mention1 mention2 mention3 mention4 invece tu ti senti rappresentata da uno che se ti conoscesse ti definirebbe culona inchiavabile"", ti prego spiegami come fai perché io non me ne capacito.""",1
mention1 mention2 mention3 mention4 mention5 mention6 mention7 mention8 mention9 mention10 mention11 mention12 mention13 mention14 mention15 mention16 mention17 mention18 te lo,1
ma salvini lo sa? è putiniano o puttanone? url,0
mention1 woowwww......  che bella tettona   ?,1
"vado a dormire che oggi rischio di insultare, mandare a fanculo e litigare pesantemente tutti questi pezzi di merda, figli di puttana e grandi cornuti e sbonnati in culo che sono gli antijuventini.... che cazzo parlano loro?!? cosa cazzo hanno vinto loro?? un beneamato cazzo!!!",0
mention1 la merkel lo ha silurato qualche anno fa non se lo ricorda ! inizi a non fare il leccaculo della culona sarebbe già qualcosa,1
porca puttana sabato a lavoro.,0
come f definisce b:-un cucciolo di libellula-una bellissima farfallina-un'iguana delle savanecome b definisce f:-una puttanella-balena spiaggiata-brutta troietta-stupida bitchin tutto ciò ho capito che fè è la troia della situazione..mention1,0
"mention1 ridi ridi pagliaccio. così diceva una canzone di qualche decennio fa ma ancora attuale. adesso aspettiamo la culona""""",1
rt mention1 mi sento solo cerco una compagna rtwittate fate girare la voglio altezza media mora tettona e culona,1
mention1 mention2 ma sei seria ? sei tu che ti sei intromessa nel discorso....... io punto il dito con chi credo che dica cazzate..... e l ho fatto con un politico tu che cazzo c entri ? non ti conosco nemmeno,0
ci sto malissimo. ma quando penso a loro due ci sto ancora di più. sto male perché io sono sempre stata una delle poche che é stata dalla loro parte. io piango a vederli ridotti così. che cazzo cavete? volete tornare voi? porca troia. url,0
"tutte piatte, manco una tettona c'hanno messo gf15",1
"ma porca puttana, che palle, vale per terra. gasado argentinagp",0
"mention1 mention2 mention3 ma quello sì, però se di dieci acquisti con 200 mln non ce n'è uno da dire porca puttana qui mirabrutti è stato proprio bravo"" qualche problema c'è""",0
parole della culona sulla siria ne abbiamo? ?,1
"volete un motivo valido per non truccarvi? no idee femministe,no sono già figa così bensì rientrare a casa alle 1.23 leggermente brilla ed avere le lenzuola pulite, per evitare l'effetto sacra sindone",0
io mi sento male porca troia non sono pronta che cazzo succede url,0
mention1 mention3it mention3 mention3fr mention3es mention3de mention3uk mention3nl mio dio mentre te lo metti in bocca io sono li sotto che ti lecco culo e figa,1
mention1 certo obama sta meglio accanto a melania che alla culona di michelle che se le togli parrucca sembra un uomo!,1
mention1 mmmmm bella fica  ti sborro sopra!!!!!  bella,1
mention1 ma che cazzo vogliono!!!!! adesso non possiamo nemmeno minacciare di stupro una sionista! url,1
mention1 facessi parlare le tue tette diresti cose almeno interessanti....sei di uno squallore infinito oltre che essere una  vecchia baldracca,1
"esistono delle basi, delle fottute basi dalle quali partire e dei confini da non superare. ci sono dei protocolli da seguire, dei limiti oltre i quali non si può andare, porca puttana maiala",0
porca puttana! saccheggiate gli elios !!!!!! ???????????????  clario url,0
mention1 amore sei una gran puttana e ho una gran voglia di godere con te adesso un bel sego e sul tuo bel culo mmmhhhh,1
e che cazzo url,0
ma le persone che quando mangino fanno un concerto che sembrano essersi riuniti tutte le band del mondo. come cazzo fare a mangiare così male porca puttana. la bocca chiusa dovete tenere. e il tuo more che fate fa schifo quanto voi!!,0
elena mi dici che cazzo fai porca troia nessuno ti ha dato il permesso url,1
dioooccanguro ho dimenticato le cuffiette a scuola e se sta merda dietro di me (meglio se non faccio nomi) non la smette gridare con la sua voce di merda le metto una fotocopiatrice in bocca porca puttana,1
mention1 anche a te bella tettona?,1
"wua e poi mia madre ha pure detto a papa- e ragazzina tolk, si metteva con un vecchio come te e che fa, per soldi!!!!!! e papa ha risposto- non e colpa tua, e colpa del puttanone che esce da puttana e alcolizzato!!!!!!!! ( wua che frase)",1
"io non mi ti si piscio di striscio. io ti inculo capello liscio.  parma, italy url",1
col cazzo che gli scrivo ahaha ceh va bene ho fatto la stronza ma lui ancora di più stronzo troione da combattimento daddy baldracco puttanone zoccolo da corsa mention1,0
mention1 ti inculo con un palo,1
mention1 che bel culone,1
mention1 ma chi? per assomigliare ad un tossico e una pompinara???,1
mention1 ma porca puttana verrà il giorno che ............è meglio non andare oltre.,0
vania sta facendo la paracula but guess what figa di legno e deve sudarsi il mio perdono,1
mention1 mmmmmmmmmmmmmm qnt ti scoperei ke belle tettone,1
mention1 mention2 mention3 mention4 mention5 mention6 mention7 mention8 mention9 mention10 mention11 mention12 mention13 che cazzo di lingua parli coglione ?,0
"è tre anni, tre anni che ci stavo assieme, e mi ha lasciata per una sporca puttana! ok? che cazzo vuoi? che cazzo ti ho fatto? url",1
"la butto lì, di francesco darà la colpa alla traversa. azione sfortunata che cambia in negativo la partita. e poi finirà con un inter-culona, che ci sta sempre bene liverpoolroma",0
"mention1 mention2 mention3 mention4 tutte balle...lasci stare salvini, pompinara.",1
mention1 porca puttana che figa che hai me la mangiarei a colazione pranzo spuntino e cena ogni giorno,1
è una vergogna una vergogna ci credevamo ci credevo porca puttana bastarda,0
che spettacolo di culona vogliosa  url,1
mention1 ti inculo con un palo,1
"poliziotto buono, poliziotto cattivopiù la troia spears si avvicina sottomessa e viscida, come un lombrico più pungiglione da scorpione è alto pronto a colpirepure latte che caghi sa demmerda sapendo che puoi colpire alle spalle senza perchè per godere..... impiccati puttana",1
fatemi vederr giordano porca puttana uominiedonne,0
mention1 esatto i nostri veri nemici sono la francia e quel fighetto di macron e la germania e quella culona della merkel!,1
mention1 pensa quanto ho fatto schifo per fare la tua stessa top porca puttana,0
"mention1 enri c'avevi ragione, porca puttana url",0
"mention1 mention2 mention3 non ho mai creduto a quella storia. non ce la vedo asia argento dire certe battutacce. io credo, invece, che molto probabilmente, abbia ignorato meloni.",0
io porca puttana lo so che il cinese mi fa stare male ora non voglio ri vomitare ma mi sa che devo odio tutto e domani devo andare a lavorare io boh,0
mention1 ma stiamo scherzando ma non le rispondere ma non visualizzarla che cazzo ma cosa pensa che vieni dalle montagne del sapone che non capisci quando una è una stronza troia ?!?! ne ra,1
ti scopo il culo troia url,1
mention1 guardala qua il puttanone ???? url,1
mention1 mmmmmmmmmmmmmm qnt ti scoperei ke belle tettone,1
"raga le cazzate che state scrivendo su harry sono veramente indecenti porca puttana, voi mi preoccupate seriamente. quel cristiano non è il vostro idolo ma la vostra ossessione, e le persone ossessionate sono malate e cazzo voi sembrate proprio malate",0
"wua e papa ha detto cose di me- gia beveva prima, grazie al puttanone e alcolizzato, zie alcolizzate ogni giorno banchetto, beveva gia vodka vicino alla finestra a 9 anni!!!!!!! ( wua che frase di me papa ha detto)",1
però sei un pochino tettona tu?  manco per il cazzo url,1
"del beychella non me ne fotte nulla, sono stanco del suo culo che ci fa aspettare un cazzo di album da due anni e sono pieno della sua aria superiore ma chi sei culona di merda.",1
mention1 mention2 bella mamma tettona da succhiare????????????????????????????,1
stai zitta troia url,1
